<?xml version="1.0" encoding="utf-8"?>
<?xml-stylesheet type="text/css" href="projekt.css" ?>
<!DOCTYPE pojazdy SYSTEM "Pojazdy.dtd">


<pojazdy>
	<pojazd id="a" typ='osobowy'>
		<marka>VolksWagen</marka>
		<model>Passat</model>
		<rok_produkcji>2005</rok_produkcji>
		<stan_licznika jednostka='km'>260253</stan_licznika>
		<numer_rejestracyjny>GKS4HH6</numer_rejestracyjny>
		<numer_vin>VWW56H8JIO231VQQO</numer_vin>
		<masa_wlasna jednostka='kg'>1607</masa_wlasna>
		<pojemnosc jednostka='cm2'>1968</pojemnosc>
		<kolor>czarny</kolor>
		<ubezpieczenie>
			<oc>
				<do>15.05.2019</do>
				<koszt waluta='PLN'>400</koszt>
				<nazwa_ubezpieczyciela>AXA</nazwa_ubezpieczyciela>
			</oc>
			<ac>
				<do>30.06.2019</do>
				<koszt waluta='PLN'>950</koszt>
				<kwota_ubezpieczenia waluta='PLN'>19000</kwota_ubezpieczenia>
				<nazwa_ubezpieczyciela>AXA</nazwa_ubezpieczyciela>
			</ac>
			<assistance>
				<do>15.06.2020</do>
				<koszt waluta='PLN'>950</koszt>
				<do_ilu_km>400</do_ilu_km>
				<zastepczy_samochod>tak</zastepczy_samochod>
				<nazwa_ubezpieczyciela>ADAC</nazwa_ubezpieczyciela>
			</assistance>
		</ubezpieczenie>
	</pojazd>
	<pojazd id="b" typ='osobowy'>
		<marka>Skoda</marka>
		<model>Rapid</model>
		<rok_produkcji>2015</rok_produkcji>
		<stan_licznika jednostka='km'>130846</stan_licznika>
		<numer_rejestracyjny>GDA3GH4</numer_rejestracyjny>
		<numer_vin>S56H8RJIO23177VQQ</numer_vin>
		<masa_wlasna jednostka='kg'>1407</masa_wlasna>
		<pojemnosc jednostka='cm2'>1368</pojemnosc>
		<kolor>zielony</kolor>
		<ubezpieczenie>
			<oc>
				<do>10.01.2020</do>
				<koszt waluta='PLN'>800</koszt>
				<nazwa_ubezpieczyciela>LINK4</nazwa_ubezpieczyciela>
			</oc>
			<ac>
				<do>13.07.2019</do>
				<koszt waluta='PLN'>1300</koszt>
				<kwota_ubezpieczenia waluta='PLN'>40000</kwota_ubezpieczenia>
				<nazwa_ubezpieczyciela>AVIVA</nazwa_ubezpieczyciela>
			</ac>
		</ubezpieczenie>
	</pojazd>
	<pojazd id="c" typ='ciezarowy'>
		<marka>Mercedes</marka>
		<model>Actros</model>
		<rok_produkcji>2018</rok_produkcji>
		<stan_licznika jednostka='km'>161532</stan_licznika>
		<numer_rejestracyjny>GST7F23</numer_rejestracyjny>
		<numer_vin>MC8527HH8T54RDS9T</numer_vin>
		<masa_wlasna jednostka='t'>7.4</masa_wlasna>
		<pojemnosc jednostka='cm2'>1968</pojemnosc>
		<kolor>czerowny</kolor>
		<ubezpieczenie>
			<oc>
				<do>17.11.2019</do>
				<koszt waluta='PLN'>2000</koszt>
				<nazwa_ubezpieczyciela>PZU</nazwa_ubezpieczyciela>
			</oc>
			<ac>
				<do>17.11.2019</do>
				<koszt waluta='PLN'>4000</koszt>
				<kwota_ubezpieczenia waluta='PLN'>230000</kwota_ubezpieczenia>
				<nazwa_ubezpieczyciela>PZU</nazwa_ubezpieczyciela>
			</ac>
			<assistance>
				<do>17.11.2019</do>
				<koszt waluta='EUR'>400</koszt>
				<do_ilu_km>1500</do_ilu_km>
				<zastepczy_samochod>nie</zastepczy_samochod>
				<nazwa_ubezpieczyciela>ADAC</nazwa_ubezpieczyciela>
			</assistance>
		</ubezpieczenie>
	</pojazd>
	<pojazd id="d" typ='kabriolet'>
		<marka>BMW</marka>
		<model>3</model>
		<rok_produkcji>2000</rok_produkcji>
		<stan_licznika jednostka='km'>370832</stan_licznika>
		<numer_rejestracyjny>GDA4DE2</numer_rejestracyjny>
		<numer_vin>B3M2W5873GRD4FE5E</numer_vin>
		<masa_wlasna jednostka='kg'>1103</masa_wlasna>
		<pojemnosc jednostka='cm2'>2396</pojemnosc>
		<kolor>srebrny</kolor>
		<ubezpieczenie>
			<oc>
				<do>01.07.2019</do>
				<koszt waluta='PLN'>550</koszt>
				<nazwa_ubezpieczyciela>WARTA</nazwa_ubezpieczyciela>
			</oc>
		</ubezpieczenie>
	</pojazd>
	<pojazd id="e" typ='dostawczy'>
		<marka>Mercedes</marka>
		<model>Vito</model>
		<rok_produkcji>2010</rok_produkcji>
		<stan_licznika jednostka='km'>190112</stan_licznika>
		<numer_rejestracyjny>GSP6777</numer_rejestracyjny>
		<numer_vin>MMMCCC777DES233F5</numer_vin>
		<masa_wlasna jednostka='kg'>3120</masa_wlasna>
		<pojemnosc jednostka='cm2'>2980</pojemnosc>
		<kolor>bia≈Çy</kolor>
		<ubezpieczenie>
			<oc>
				<do>31.12.2019</do>
				<koszt waluta='PLN'>1100</koszt>
				<nazwa_ubezpieczyciela>UNICA</nazwa_ubezpieczyciela>
			</oc>
			<ac>
				<do>31.12.2019</do>
				<koszt waluta='PLN'>1300</koszt>
				<kwota_ubezpieczenia waluta='PLN'>70000</kwota_ubezpieczenia>
				<nazwa_ubezpieczyciela>UNICA</nazwa_ubezpieczyciela>
			</ac>
			<assistance>
				<do>10.02.2020</do>
				<koszt waluta='PLN'>1000</koszt>
				<do_ilu_km>200</do_ilu_km>
				<zastepczy_samochod>tak</zastepczy_samochod>
				<nazwa_ubezpieczyciela>UNICA</nazwa_ubezpieczyciela>
			</assistance>
		</ubezpieczenie>
	</pojazd>
	<pojazd id="f" typ='osobowy'>
		<marka>Audi</marka>
		<model>A5</model>
		<rok_produkcji>2011</rok_produkcji>
		<stan_licznika jednostka='km'>160153</stan_licznika>
		<numer_rejestracyjny>GKS4HH6</numer_rejestracyjny>
		<numer_vin>A3UD7665GF4F38SH5G</numer_vin>
		<masa_wlasna jednostka='kg'>1462</masa_wlasna>
		<pojemnosc jednostka='cm2'>2974</pojemnosc>
		<kolor>czarny</kolor>
		<ubezpieczenie>
			<oc>
				<do>02.01.2020</do>
				<koszt waluta='PLN'>410</koszt>
				<nazwa_ubezpieczyciela>PZU</nazwa_ubezpieczyciela>
			</oc>
			<assistance>
				<do>03.09.2019</do>
				<koszt waluta='PLN'>250</koszt>
				<do_ilu_km>100</do_ilu_km>
				<zastepczy_samochod>nie</zastepczy_samochod>
				<nazwa_ubezpieczyciela>WARTA</nazwa_ubezpieczyciela>
			</assistance>
		</ubezpieczenie>
	</pojazd>
		<pojazd id="g" typ='pickup'>
		<marka>VolksWagen</marka>
		<model>Amarok</model>
		<rok_produkcji>2011</rok_produkcji>
		<stan_licznika jednostka='km'>219321</stan_licznika>
		<numer_rejestracyjny>GKS1EE3</numer_rejestracyjny>
		<numer_vin>VWW87GG54YY6ERD66</numer_vin>
		<masa_wlasna jednostka='kg'>2156</masa_wlasna>
		<pojemnosc jednostka='cm2'>2371</pojemnosc>
		<kolor>siwy</kolor>
		<ubezpieczenie>
			<oc>
				<do>14.06.2019</do>
				<koszt waluta='PLN'>400</koszt>
				<nazwa_ubezpieczyciela>AXA</nazwa_ubezpieczyciela>
			</oc>
			<ac>
				<do>14.06.2019</do>
				<koszt waluta='PLN'>950</koszt>
				<kwota_ubezpieczenia waluta='PLN'>67000</kwota_ubezpieczenia>
				<nazwa_ubezpieczyciela>AXA</nazwa_ubezpieczyciela>
			</ac>
		</ubezpieczenie>
	</pojazd>
	<typy_pojazdow>
		<typ id="osobowy">osobowy</typ>
		<typ id="ciezarowy">ciezarowy</typ>
		<typ id="kabriolet">kabriolet</typ>
		<typ id="pickup">pickup</typ>
		<typ id="dostawczy">dostawczy</typ>
	</typy_pojazdow>
</pojazdy>